{
  "$schema": "http://json-schema.org/draft-07/schema#",
  "$ref": "#/definitions/Proposal",
  "definitions": {
    "Proposal": {
      "title": "Proposal",
      "type": "object",
      "properties": {
        "name": {
          "type": "string",
          "title": "name",
          "minLength": 1,
          "maxLength": 256
        },
        "body": {
          "type": "string",
          "title": "body",
          "minLength": 0
        },
        "discussion": {
          "type": "string",
          "format": "customUrl",
          "title": "discussion",
          "maxLength": 256
        },
        "choices": {
          "type": "array",
          "title": "choices",
          "minItems": 1,
          "items": {
            "type": "string",
            "minLength": 1,
            "maxLength": 256,
            "pattern": "^(?!\\s*$).+"
          },
          "errorMessage": {
            "items": {
              "pattern": "Choice cannot be blank or contain only whitespace"
            }
          }
        },
        "labels": {
          "type": "array",
          "title": "labels",
          "maxItems": 10,
          "uniqueItems": true,
          "items": {
            "type": "string",
            "minLength": 1,
            "maxLength": 8,
            "pattern": "^[a-zA-Z0-9]+$"
          }
        },
        "type": {
          "type": "string",
          "enum": [
            "single-choice",
            "approval",
            "ranked-choice",
            "quadratic",
            "copeland",
            "weighted",
            "custom",
            "basic"
          ]
        },
        "snapshot": {
          "type": "number",
          "title": "snapshot"
        },
        "start": {
          "type": "number",
          "title": "start",
          "minimum": 1000000000,
          "maximum": 2000000000
        },
        "end": {
          "type": "number",
          "title": "end",
          "minimum": 1000000000,
          "maximum": 2000000000
        },
        "metadata": {
          "type": "object",
          "title": "metadata"
        },
        "app": {
          "type": "string",
          "title": "app",
          "maxLength": 24
        },
        "privacy": {
          "type": "string",
          "enum": ["", "shutter"]
        }
      },
      "required": ["name", "body", "choices", "snapshot", "start", "end"],
      "additionalProperties": false
    }
  }
}
